{"changedEntries":{"artifactType":"changed-entry-set","byteLength":4868,"sha256":"6dc03b828e3757a826fd6c21cc33dd0b2d929219a536449e40afbbc2de81361d"},"cipherText":{"artifactType":"cipher-view","byteLength":239069,"sha256":"ae0d7345fd279b038179f2822493f29cb9bab16d7190ac41699659e0ab7736b5"},"contractId":"revision-instance","instanceId":"revision-amber","matchedControls":{"artifactType":"matched-stable-controls","byteLength":5231,"sha256":"2947c62f375ce79e5c5dc05204d2fc65212b087cbe7d32eabcd25c999aa6a48c"},"postSwitchTokenCount":12859,"preSwitchTokenCount":14645,"preparedText":{"artifactType":"prepared-plaintext","byteLength":162641,"sha256":"47c1c87dce7b777878673d1fa8082fe8d4b4d9e6932858fca0090c4b52e4fd4f"},"profileId":"partial-rekey-literary-v1","revisedKey":{"artifactType":"revised-key","byteLength":92551,"sha256":"8a47adcf812a478e4fb6b794ad1738961ae7426f8466eceda9a283eed25761c8"},"schemaVersion":1,"sourceId":"middlemarch","stationaryKey":{"artifactType":"stationary-key","byteLength":92551,"sha256":"c83c341e0b2543b61d8000f7a8e9e4b3ccc33d296aaa18328f3210482fd2b89e"},"switchAfterChapter":12,"switchWordOffset":14645,"tokenCount":27504}